{
  "schema_version": "1.0",
  "desktop": {
    "shell": "Persistent global section rail, scoped context header, work area, and non-modal sync/notification status",
    "default_entry": "/today",
    "patterns": [
      "global section",
      "workflow workspace",
      "entity history",
      "cross-scope comparison",
      "exception queue"
    ]
  },
  "mobile": {
    "shell": "Today, assignments, capture, exceptions, and sync queue with explicit current scope",
    "default_entry": "/today",
    "patterns": [
      "next assignment",
      "single-field capture",
      "scan/select identity",
      "offline journal",
      "handoff acknowledgement"
    ]
  },
  "role_entries": [
    {
      "role_id": "ROLE-VINEYARD-MANAGER",
      "home_route": "/today",
      "workflow_ids": [
        "WF-001",
        "WF-002",
        "WF-003",
        "WF-004",
        "WF-005",
        "WF-006",
        "WF-007",
        "WF-008",
        "WF-009",
        "WF-010"
      ],
      "primary_screen_ids": [
        "SCR-001",
        "SCR-002",
        "SCR-003",
        "SCR-004",
        "SCR-005",
        "SCR-006",
        "SCR-007",
        "SCR-008",
        "SCR-009",
        "SCR-010",
        "SCR-011",
        "SCR-012",
        "SCR-013",
        "SCR-014",
        "SCR-015",
        "SCR-016",
        "SCR-017",
        "SCR-018",
        "SCR-019",
        "SCR-020",
        "SCR-021",
        "SCR-022",
        "SCR-023",
        "SCR-024",
        "SCR-025",
        "SCR-026",
        "SCR-027",
        "SCR-028",
        "SCR-029",
        "SCR-030",
        "SCR-031",
        "SCR-032",
        "SCR-033",
        "SCR-034",
        "SCR-035",
        "SCR-036",
        "SCR-037",
        "SCR-038",
        "SCR-039",
        "SCR-040",
        "SCR-041",
        "SCR-042",
        "SCR-043",
        "SCR-044",
        "SCR-045",
        "SCR-046",
        "SCR-047",
        "SCR-048",
        "SCR-049",
        "SCR-050",
        "SCR-051",
        "SCR-052",
        "SCR-053",
        "SCR-054",
        "SCR-055",
        "SCR-056",
        "SCR-057",
        "SCR-058",
        "SCR-059",
        "SCR-060",
        "SCR-061",
        "SCR-062",
        "SCR-063",
        "SCR-064",
        "SCR-065",
        "SCR-066",
        "SCR-067"
      ],
      "exception_route": "/exceptions?role=ROLE-VINEYARD-MANAGER"
    },
    {
      "role_id": "ROLE-VITICULTURIST",
      "home_route": "/today",
      "workflow_ids": [
        "WF-001",
        "WF-002",
        "WF-003",
        "WF-004",
        "WF-005",
        "WF-009"
      ],
      "primary_screen_ids": [
        "SCR-001",
        "SCR-002",
        "SCR-003",
        "SCR-004",
        "SCR-005",
        "SCR-006",
        "SCR-007",
        "SCR-008",
        "SCR-009",
        "SCR-010",
        "SCR-011",
        "SCR-012",
        "SCR-013",
        "SCR-014",
        "SCR-015",
        "SCR-016",
        "SCR-017",
        "SCR-018",
        "SCR-019",
        "SCR-020",
        "SCR-021",
        "SCR-022",
        "SCR-023",
        "SCR-024",
        "SCR-025",
        "SCR-026",
        "SCR-027",
        "SCR-028",
        "SCR-029",
        "SCR-030",
        "SCR-053",
        "SCR-054",
        "SCR-055",
        "SCR-056",
        "SCR-057",
        "SCR-058",
        "SCR-059"
      ],
      "exception_route": "/exceptions?role=ROLE-VITICULTURIST"
    },
    {
      "role_id": "ROLE-FOREMAN",
      "home_route": "/today",
      "workflow_ids": ["WF-001", "WF-002", "WF-007", "WF-008", "WF-010"],
      "primary_screen_ids": [
        "SCR-001",
        "SCR-002",
        "SCR-003",
        "SCR-004",
        "SCR-005",
        "SCR-006",
        "SCR-007",
        "SCR-008",
        "SCR-009",
        "SCR-010",
        "SCR-011",
        "SCR-012",
        "SCR-039",
        "SCR-040",
        "SCR-041",
        "SCR-042",
        "SCR-043",
        "SCR-044",
        "SCR-045",
        "SCR-046",
        "SCR-047",
        "SCR-048",
        "SCR-049",
        "SCR-050",
        "SCR-051",
        "SCR-052",
        "SCR-060",
        "SCR-061",
        "SCR-062",
        "SCR-063",
        "SCR-064",
        "SCR-065",
        "SCR-066",
        "SCR-067"
      ],
      "exception_route": "/exceptions?role=ROLE-FOREMAN"
    },
    {
      "role_id": "ROLE-OPERATIONS-COORDINATOR",
      "home_route": "/today",
      "workflow_ids": ["WF-001", "WF-007", "WF-008", "WF-010"],
      "primary_screen_ids": [
        "SCR-001",
        "SCR-002",
        "SCR-003",
        "SCR-004",
        "SCR-005",
        "SCR-006",
        "SCR-039",
        "SCR-040",
        "SCR-041",
        "SCR-042",
        "SCR-043",
        "SCR-044",
        "SCR-045",
        "SCR-046",
        "SCR-047",
        "SCR-048",
        "SCR-049",
        "SCR-050",
        "SCR-051",
        "SCR-052",
        "SCR-060",
        "SCR-061",
        "SCR-062",
        "SCR-063",
        "SCR-064",
        "SCR-065",
        "SCR-066",
        "SCR-067"
      ],
      "exception_route": "/exceptions?role=ROLE-OPERATIONS-COORDINATOR"
    },
    {
      "role_id": "ROLE-FIELD-CREW",
      "home_route": "/today",
      "workflow_ids": ["WF-001", "WF-007"],
      "primary_screen_ids": [
        "SCR-001",
        "SCR-002",
        "SCR-003",
        "SCR-004",
        "SCR-005",
        "SCR-006",
        "SCR-039",
        "SCR-040",
        "SCR-041",
        "SCR-042",
        "SCR-043",
        "SCR-044",
        "SCR-045"
      ],
      "exception_route": "/exceptions?role=ROLE-FIELD-CREW"
    },
    {
      "role_id": "ROLE-CONTRACTOR",
      "home_route": "/today",
      "workflow_ids": ["WF-001", "WF-008", "WF-010"],
      "primary_screen_ids": [
        "SCR-001",
        "SCR-002",
        "SCR-003",
        "SCR-004",
        "SCR-005",
        "SCR-006",
        "SCR-046",
        "SCR-047",
        "SCR-048",
        "SCR-049",
        "SCR-050",
        "SCR-051",
        "SCR-052",
        "SCR-060",
        "SCR-061",
        "SCR-062",
        "SCR-063",
        "SCR-064",
        "SCR-065",
        "SCR-066",
        "SCR-067"
      ],
      "exception_route": "/exceptions?role=ROLE-CONTRACTOR"
    },
    {
      "role_id": "ROLE-COMPLIANCE-COORDINATOR",
      "home_route": "/today",
      "workflow_ids": [
        "WF-001",
        "WF-002",
        "WF-003",
        "WF-008",
        "WF-009",
        "WF-010"
      ],
      "primary_screen_ids": [
        "SCR-001",
        "SCR-002",
        "SCR-003",
        "SCR-004",
        "SCR-005",
        "SCR-006",
        "SCR-007",
        "SCR-008",
        "SCR-009",
        "SCR-010",
        "SCR-011",
        "SCR-012",
        "SCR-013",
        "SCR-014",
        "SCR-015",
        "SCR-016",
        "SCR-017",
        "SCR-018",
        "SCR-046",
        "SCR-047",
        "SCR-048",
        "SCR-049",
        "SCR-050",
        "SCR-051",
        "SCR-052",
        "SCR-053",
        "SCR-054",
        "SCR-055",
        "SCR-056",
        "SCR-057",
        "SCR-058",
        "SCR-059",
        "SCR-060",
        "SCR-061",
        "SCR-062",
        "SCR-063",
        "SCR-064",
        "SCR-065",
        "SCR-066",
        "SCR-067"
      ],
      "exception_route": "/exceptions?role=ROLE-COMPLIANCE-COORDINATOR"
    },
    {
      "role_id": "ROLE-SCOUT",
      "home_route": "/today",
      "workflow_ids": ["WF-002"],
      "primary_screen_ids": [
        "SCR-007",
        "SCR-008",
        "SCR-009",
        "SCR-010",
        "SCR-011",
        "SCR-012"
      ],
      "exception_route": "/exceptions?role=ROLE-SCOUT"
    },
    {
      "role_id": "ROLE-CROP-PROTECTION-LEAD",
      "home_route": "/today",
      "workflow_ids": ["WF-002"],
      "primary_screen_ids": [
        "SCR-007",
        "SCR-008",
        "SCR-009",
        "SCR-010",
        "SCR-011",
        "SCR-012"
      ],
      "exception_route": "/exceptions?role=ROLE-CROP-PROTECTION-LEAD"
    },
    {
      "role_id": "ROLE-PESTICIDE-HANDLER",
      "home_route": "/today",
      "workflow_ids": ["WF-002", "WF-010"],
      "primary_screen_ids": [
        "SCR-007",
        "SCR-008",
        "SCR-009",
        "SCR-010",
        "SCR-011",
        "SCR-012",
        "SCR-060",
        "SCR-061",
        "SCR-062",
        "SCR-063",
        "SCR-064",
        "SCR-065",
        "SCR-066",
        "SCR-067"
      ],
      "exception_route": "/exceptions?role=ROLE-PESTICIDE-HANDLER"
    },
    {
      "role_id": "ROLE-REGULATOR",
      "home_route": "/today",
      "workflow_ids": ["WF-002", "WF-010"],
      "primary_screen_ids": [
        "SCR-007",
        "SCR-008",
        "SCR-009",
        "SCR-010",
        "SCR-011",
        "SCR-012",
        "SCR-060",
        "SCR-061",
        "SCR-062",
        "SCR-063",
        "SCR-064",
        "SCR-065",
        "SCR-066",
        "SCR-067"
      ],
      "exception_route": "/exceptions?role=ROLE-REGULATOR"
    },
    {
      "role_id": "ROLE-IRRIGATION-LEAD",
      "home_route": "/today",
      "workflow_ids": ["WF-003", "WF-010"],
      "primary_screen_ids": [
        "SCR-013",
        "SCR-014",
        "SCR-015",
        "SCR-016",
        "SCR-017",
        "SCR-018",
        "SCR-060",
        "SCR-061",
        "SCR-062",
        "SCR-063",
        "SCR-064",
        "SCR-065",
        "SCR-066",
        "SCR-067"
      ],
      "exception_route": "/exceptions?role=ROLE-IRRIGATION-LEAD"
    },
    {
      "role_id": "ROLE-IRRIGATOR",
      "home_route": "/today",
      "workflow_ids": ["WF-003"],
      "primary_screen_ids": [
        "SCR-013",
        "SCR-014",
        "SCR-015",
        "SCR-016",
        "SCR-017",
        "SCR-018"
      ],
      "exception_route": "/exceptions?role=ROLE-IRRIGATOR"
    },
    {
      "role_id": "ROLE-LAB",
      "home_route": "/today",
      "workflow_ids": ["WF-003", "WF-005"],
      "primary_screen_ids": [
        "SCR-013",
        "SCR-014",
        "SCR-015",
        "SCR-016",
        "SCR-017",
        "SCR-018",